[
  {"character":"도희","baseline":"상대와 거리가 있을 때 완결된 존댓말을 쓴다.","underStress":"문장이 짧아져도 관계 단계에 맞는 호칭은 유지한다.","addressRules":[{"target":"민준","stage":"경계","term":"선생님"},{"target":"민준","stage":"협력","term":"민준 씨"},{"target":"민준","stage":"신뢰","term":"민준"}],"status":"OBSERVED","evidence":[{"sourceId":"src-fixture","fileName":"합성예제.md","chapter":"3장 함께","paragraph":1,"paragraphHash":"f583514653d9cc4b62be77e6f73abf6de948442d30635e3faae0cc5f7c3e0db1","excerpt":"마지막 문 앞에서 도희는 민준, 같이 가자고 말했다."}]}
]
